Title,Description,URL,PublishedAt,Source
UBS Will Pay $511 Million to End Credit Suisse US Tax Probe,"UBS Group AG agreed to pay $511 million to settle a US investigation into how Credit Suisse Group, the Swiss bank it bought, helped rich Americans evade taxes even after pledging to stop the practice a decade ago.",https://www.livemint.com/companies/news/ubs-will-pay-511-million-to-end-credit-suisse-us-tax-probe-11746482450378.html,2025-05-05T22:00:49Z,Livemint
"Rite Aid Files for Second Bankruptcy, Announces Job Cuts","Less than a year after completing a restructuring that was supposed to turn the troubled pharmacy chain around, Rite Aid Corp. has filed for bankruptcy again.",https://www.livemint.com/companies/news/rite-aid-files-for-second-bankruptcy-announces-job-cuts-11746478298267.html,2025-05-05T20:51:37Z,Livemint
OpenAI’s Nonprofit Will Retain Control After Public Pushback,"OpenAI is moving forward with plans to become a more conventional for-profit business, but with a key change designed to appease critics: After the restructuring is completed, the company’s nonprofit will remain in control of the overall business.",https://www.livemint.com/companies/news/openais-nonprofit-will-retain-control-after-public-pushback-11746470990086.html,2025-05-05T18:49:49Z,Livemint
"ITR Filing: इनकम टैक्स डिपार्टमेंट ने जारी किया ITR-2 फॉर्म, जानिए 5 बड़े बदलाव","ITR Filing: वित्त वर्ष 2024-25 (Assessment Year 2025-26) के लिए आयकर विभाग ने ITR-2 फॉर्म को नोटिफाई कर दिया है। यह फॉर्म उन इंडिविजुअल और हिंदू अविभाजित परिवारों (HUFs) के लिए है, जिन्हें व्यापार या पेशे (Business or Profession) से कोई आय नहीं होती। इस बार फ…",https://hindi.moneycontrol.com/news/your-money/income-tax-department-notifies-itr-2-form-key-changes-and-impact-1975509.html,2025-05-05T16:22:05Z,Moneycontrol
"Indian Hotels plans ₹1,200 crore investment for FY26, eyes sustained growth","Indian Hotels will invest  ₹1,200 crore in FY26, aiming for growth through asset upgrades and new projects, particularly in the Taj Hotels brand. FY25 results included a 53% net profit surge and a 23% revenue increase.",https://www.livemint.com/companies/news/indian-hotels-plans-1-200-crore-investment-for-fy26-eyes-sustained-growth-11746449090561.html,2025-05-05T16:11:53Z,Livemint
"Skechers set to be acquired and taken private by 3G Capital in $9 billion deal, shares jump over 25%","Under the terms of the definitive merger agreement , 3G Capital has agreed to pay $63.00 per share in cash for all outstanding shares of Skechers",https://www.livemint.com/companies/news/skechers-set-to-be-acquired-and-taken-private-by-3g-capital-in-9-billion-deal-shares-jump-over-25-per-cent-11746458621252.html,2025-05-05T15:44:20Z,Livemint
Ather Energy IPO: Will the slow and steady builder outperform Ola on the markets?,"Ather Energy has had a successful IPO and is all set to list. Will the stock fall below its IPO price, a curse that has befallen many newage companies, particularly rival Ola Electric, or will it soar on the hard work put in by the founders to build a deeptec…",https://www.livemint.com/companies/ather-energy-ipo-ola-electric-vehicle-scooter-deeptech-ev-two-wheeler-market-startup-hero-motocorp-tarun-mehta-11746451437091.html,2025-05-05T14:43:41Z,Livemint
"Cotton yarn industry set to spin 7–9% revenue growth in FY26 on China export rebound, domestic demand: Crisil","Yarn exports account for about 30% of the industry’s total revenue, with China alone making up nearly half of that share.",https://www.livemint.com/industry/cotton-yarn-revenue-growth-fy26-china-export-domestic-demand-crisil-11746436551303.html,2025-05-05T14:16:31Z,Livemint
Joy Personal Care to step up distribution as it plans to double revenues,The company will prioritize direct outreach to more outlets and step up its presence through e-commerce.,https://www.livemint.com/companies/news/joy-personal-care-to-step-up-distribution-as-it-plans-to-double-revenues-11746443107528.html,2025-05-05T14:08:21Z,Livemint
Highest-paid CEO of US earns nine figure salary. It's not Tim Cook or Satya Nadella; here's how much he earned in 2024,"The US'highest paid CEO, Jim Anderson, has not been much heard about. However, he is the only CEO in the top 10 list whose salary crosses nine figures at almost $101.50 million.",https://www.livemint.com/companies/people/world-highest-paid-ceo-earn-nine-figure-salary-not-tim-cook-or-satya-nadella-he-earned-in-2024-coherent-ceo-jim-anderson-11746445034408.html,2025-05-05T13:55:59Z,Livemint
"Amplus Solar rebrands as Gentari, Pungalia named India head","By consolidating Amplus Solar under its brand and appointing a new India head, Gentari is streamlining its clean energy operations to sharpen its focus on the country’s rapidly expanding renewable and green hydrogen markets.",https://www.livemint.com/companies/news/amplus-solar-rebrands-to-gentari-pungalia-takes-over-as-gentaris-india-head-11746446005411.html,2025-05-05T12:27:46Z,Livemint
"Filing ITR 2025: As ITR forms 1, 2, 3, 4 and 5 are notified, check which form applies to you","The Income Tax (I-T) department has already released forms ITR-1, ITR-2, ITR-3, ITR-4 and ITR-5. Here we explain which forms apply to which taxpayer",https://www.livemint.com/money/personal-finance/filing-itr-2025-as-itr-forms-1-2-3-4-and-5-are-notified-check-which-form-applies-to-you-11746441624451.html,2025-05-05T11:26:49Z,Livemint
Drugmakers to face tougher quality rules: Failed a test? Re-do the exam.,"A new government crackdown on substandard drugs could turn India's pharmaceutical industry upside down, reshaping accountability in India’s vast generic drug market.",https://www.livemint.com/industry/drugmakers-quality-checks-substandard-medicines-spurious-drugs-product-permission-license-drugs-rules-amendment-11746424232673.html,2025-05-05T10:26:59Z,Livemint
Greg Abel's biggest challenge — is Berkshire Hathaway stock worth the ‘Buffett’ premium without Warren Buffett?,"With Warren Buffett confirming he is on his way out of the CEO seat by this year's end, successor Greg Abel has big challenges to face — filling big shoes and proving that Berkshire Hathaway is still worth the “Buffett premium”.",https://www.livemint.com/companies/people/greg-abel-biggest-challenge-berkshire-hathaway-stock-worth-premium-value-without-warren-buffett-investor-confidence-news-11746424558339.html,2025-05-05T10:06:32Z,Livemint
Top 5 mistakes to avoid while filing your income tax return in 2025-26,"Avoid penalties and delays this ITR season by steering clear of common tax filing mistakes. Understand and learn the top five errors to dodge for smooth, accurate income tax return filing for AY 2025–26.",https://www.livemint.com/money/personal-finance/top-5-mistakes-to-avoid-while-filing-your-income-tax-return-in-2025-26-itr-11746435246815.html,2025-05-05T09:36:25Z,Livemint
"Does the arc of history bend towards justice? No, it’s a fallacy",What Martin Luther King Jr cited to inspire hope mustn’t be taken as a statement of inevitability. Such sayings foster the sort of complacency that makes space for injustice to win.,https://www.livemint.com/opinion/online-views/moral-arc-of-history-martin-luther-king-jr-donald-trump-ronald-reagan-karl-popper-francis-fukuyama-vladimir-putin-china-11746108527911.html,2025-05-05T09:30:14Z,Livemint
Nouriel Roubini: US economic tailwinds will help it overcome tariff headwinds,"America’s strong institutions, zest for innovation and AI-led capex boom will keep its economic growth going, even as Trump is forced to back-track on his policies. The US will survive the Trump shock and thrive again after a period of pain.",https://www.livemint.com/opinion/online-views/donald-trump-trade-policy-us-china-trade-war-jerome-powell-fed-independence-ai-investment-boom-draghi-report-dollar-11746107188366.html,2025-05-05T08:30:13Z,Livemint
The rise of Hollywood-style cinematic universes in southern films,"The southern film industry is embracing cinematic universes, which mirrors Hollywood's success, focusing on star power to attract viewers while navigating challenges of rising costs tied to popular actors",https://www.livemint.com/industry/media/southern-film-industry-bollywood-movie-industry-cinematic-universes-hollywood-film-industry-ott-release-11746074854472.html,2025-05-05T07:31:48Z,Livemint
Complete justice: Article 142 should be invoked only in truly rare cases,The Tamil Nadu legislation case has revived calls for restraint in the judiciary’s use of this extraordinary power. Perhaps complete humility ought to accompany judicial efforts to deliver complete justice.,https://www.livemint.com/opinion/online-views/article-142-supreme-court-india-jagdeep-dhankhar-iim-ahmedabad-bhopal-gas-tragedy-union-carbide-niti-aayog-overreach-11746340007077.html,2025-05-05T07:00:11Z,Livemint
Anurag Behar: Don’t let the ‘alignment problem’ of our systems fester,"There’s a disconnect between the welfare of society and what institutions and individuals do. If we don’t fix our systems, they will eventually collapse under the weight of their own contradictions.",https://www.livemint.com/opinion/online-views/human-system-alignment-systemic-failure-ethical-leadership-institutional-values-climate-collapse-governance-reform-edu-11745924521060.html,2025-05-05T06:30:10Z,Livemint
"Law ministry to start work on plugging gaps in arbitration law, as directed by Supreme Court","The law ministry is also working on the Arbitration and Conciliation (Amendment) Bill, 2024, which aims to promote institutional arbitration and limit court interventions.",https://www.livemint.com/companies/law-ministry-gaps-in-arbitration-law-supreme-court-arbitration-arbitral-tribunal-11746419497751.html,2025-05-05T06:05:52Z,Livemint
"Warren Buffett's ‘bull run’ at Berkshire Hathaway — whopping 55,00,000% returns, $1.2trn company, $167bn share value!","As billionaire investor Warren Buffett confirmed he will be stepping away from Berkshire Hathaway by 2025-end, we take a look at the Oracle of Omaha's six-decade “bull run” at the helm.&nbsp;",https://www.livemint.com/companies/people/warren-buffett-bull-run-berkshire-hathaway-whopping-5500000-pc-profit-1-trillion-company-167-billion-shares-value-market-11746416023142.html,2025-05-05T05:46:02Z,Livemint
The House is trying to kill Tesla’s EV credits. What happens next.,Investors need to keep an eye on what President Trump and the Republican-controlled Congress plan to do with California’s ability to regulate its own air quality.,https://www.livemint.com/companies/the-house-is-trying-to-kill-tesla-s-ev-credits-what-happens-next-11746417022057.html,2025-05-05T04:17:36Z,Livemint
How one of Europe's most-valued fintechs wants to capture India's remittance market,"Revolut will offer three different kinds of payment options to users—the PPI or prepaid payment instrument wallet and a linked prepaid card for domestic payments, a forex card for international merchant payments and the third for remittances",https://www.livemint.com/companies/news/revolut-fintechs-remittance-upi-market-europe-lendingkart-ppi-wallet-arvog-forex-cross-border-travel-rbi-payments-11746339592801.html,2025-05-05T03:57:39Z,Livemint
"Good Glamm delays April salaries, yet to settle full dues to former employees","Good Glamm has seen a lot of churn in recent months as the company grapples with a severe cash crunch that forced it to consider raising fresh funds at a sharply lower valuation, which triggered the exit of three of its directors.",https://www.livemint.com/companies/news/good-glamm-delays-april-salaries-yet-to-settle-full-dues-to-former-employees-11746348786376.html,2025-05-05T00:45:15Z,Livemint
Uber’s lifeline off the table for BluSmart as EV depreciation becomes key contention,Talks had started as part of BluSmart’s plan to revive operations of its cabs. BluSmart was supposed to act as a fleet partner for Uber.,https://www.livemint.com/companies/uber-blusmart-ev-gensol-engineering-anmol-jaggi-refex-group-cars24-power-finance-corporation-ireda-azure-power-nifty-11746351165193.html,2025-05-05T00:00:14Z,Livemint
"REITs में कैसे करें निवेश? जानिए रिटर्न, जोखिम और टैक्सेशन की पूरी डिटेल","पिछले कुछ साल में REITs (रियल एस्टेट इन्वेस्टमेंट ट्रस्ट्स) भारतीय निवेशकों के लिए रियल एस्टेट में पैसा लगाने का एक बेहतरीन विकल्प बनकर उभरे हैं, वो भी बिना कोई फ्लैट या ऑफिस खरीदे। खासतौर पर बड़े शहरों में ऑफिस और मॉल जैसे हाई-क्वालिटी कमर्शियल स्पेस बढ़ने स…",https://hindi.moneycontrol.com/news/your-money/reits-investment-india-returns-tax-risks-full-details-1975242.html,2025-05-04T18:01:26Z,Moneycontrol
"Dividend Stocks: इस हफ्ते डिविडेंड, स्टॉक स्प्लिट और राइट इश्यू की बारिश, चेक करें रिकॉर्ड डेट",Dividend Stocks: इस सप्ताह शेयर बाजार में कई कंपनियों के शेयर अलग-अलग कॉर्पोरेट एक्शन के चलते एक्स-डेट पर ट्रेड करेंगे। इनमें अंतरिम और फाइनल डिविडेंड से लेकर स्टॉक स्प्लिट और राइट इश्यू तक शामिल हैं। आइए जानें किन कंपनियों के शेयरों पर रहेगी नजर:अंतरिम डिविड…,https://hindi.moneycontrol.com/news/markets/dividend-stock-split-rights-issue-5-to-9-may-2025-record-date-1975232.html,2025-05-04T16:55:03Z,Moneycontrol
HDFC Bank is beginning to fire again. Can it take on the Bank of China?,"Many brokerages believe that the worst is over for HDFC Bank’s stock—they have raised the target price for its shares. The bank, India’s second-most valued company after Reliance Industries, can now shake up the pecking order of top global banks.",https://www.livemint.com/companies/hdfc-bank-sashidhar-jagdishan-market-value-stock-target-price-bank-of-china-reliance-global-banks-11746367039558.html,2025-05-04T14:20:32Z,Livemint
How a US tech giant’s AI ambitions came to be Indian IT’s bugbear,Sonata Software’s clarion call flagging lower business from a top client comes at a time when larger Indian IT outsources have started baking in GenAI-led efficiencies in their conversations with clients.,https://www.livemint.com/companies/indian-it-companies-global-tech-giant-artificial-intelligence-ai-genai-impact-revenue-hit-it-business-model-11746101417173.html,2025-05-04T10:45:27Z,Livemint
Money tips and tricks from people who want to retire early,Saving a big portion of what you earn gives you a lot of freedom no matter what you do.,https://www.livemint.com/money/personal-finance/money-tips-and-tricks-from-people-who-want-to-retire-early-11746345935713.html,2025-05-04T10:30:12Z,Livemint
"Can AI truly transform businesses? Yes, if adopted thoughtfully","Amid signs of AI overhype and disappointment in its impact on enterprises, there is a way to derive value for this technology. Here’s what McKinsey has found works.",https://www.livemint.com/opinion/online-views/artificial-intelligence-machine-learning-mckinsey-digital-transformation-customer-engagement-productivity-gains-copilots-11746191383758.html,2025-05-04T10:30:11Z,Livemint
"Who is Greg Abel? All about the next CEO of Berkshire Hathaway, designated successor by Warren Buffett","Warren Buffett announced Greg Abel as his successor as CEO of Berkshire Hathaway, by 2025-end. We explain who Greg Abel is, and the challenges he faces following Warren Buffett's remarkable investment track record. &nbsp; &nbsp; &nbsp; &nbsp; &nbsp; &nbsp; &n…",https://www.livemint.com/companies/people/who-is-greg-abel-meet-warren-buffett-name-designate-successor-next-ceo-berkshire-hathaway-business-challenges-investment-11746340655525.html,2025-05-04T08:41:33Z,Livemint
"Why Warren Buffett's son, Howie Buffett, won't be CEO of Berkshire Hathway","Warren Buffett announced his retirement on May 3, designating Greg Abel as his successor CEO. His middle-child, Howie Buffett will become non-executive chairman — here's why.",https://www.livemint.com/companies/people/why-warren-buffett-son-howie-howard-buffett-will-not-be-ceo-berkshire-hathway-named-successor-greg-abel-business-us-news-11746333423687.html,2025-05-04T07:23:26Z,Livemint
"Microfinance stress, RBI embargo weighed on Kotak Bank’s Q4 profitability","Kotak Mahindra Bank's agriculture portfolio grew a muted 1% on-year in the March quarter, and its retail microcredit loan portfolio fell 33%. The bank aims to grow its share of unsecured and personal loans to around 15% of its advances.",https://www.livemint.com/industry/banking/kotak-mahindra-bank-q4-profit-rbi-embargo-credit-cards-microfinance-rural-borrowings-unsecured-loans-credit-growth-11746283016708.html,2025-05-04T05:42:20Z,Livemint
Fired Kohl’s CEO Said to Have Had History of Mixing Relationship With Work,The decision to oust Buchanan raised questions about what the company knew about a relationship that is said to have had long blurred professional lines.,https://www.livemint.com/companies/news/fired-kohl-s-ceo-said-to-have-had-history-of-mixing-relationship-with-work-11746316149388.html,2025-05-03T23:49:08Z,Livemint
"Berkshire shareholders reject diversity, AI proposals","BERKSHIRE-BUFFETT/PROXY (PIX):Berkshire shareholders reject diversity, AI proposals",https://www.livemint.com/companies/news/berkshire-shareholders-reject-diversity-ai-proposals-11746303476491.html,2025-05-03T20:17:56Z,Livemint
"Buffett to step down as Berkshire CEO, Abel to take over","BERKSHIRE-BUFFETT/ (WRAPUP 5, PIX):WRAPUP 5-Buffett to step down as Berkshire CEO, Abel to take over",https://www.livemint.com/companies/news/buffett-to-step-down-as-berkshire-ceo-abel-to-take-over-11746298180032.html,2025-05-03T18:49:39Z,Livemint
American Airlines Sues Chicago Over O’Hare Gates for United,American Airlines Group Inc. sued the city of Chicago in a fight with rival United Airlines Holding Inc. over valuable gate space at O’Hare International Airport.,https://www.livemint.com/companies/news/american-airlines-sues-chicago-over-o-hare-gates-for-united-11746297994190.html,2025-05-03T18:46:33Z,Livemint
"Tata Group, Bharti Airtel terminate merger talks to expand DTH business","Tata Group, Bharti Airtel terminate merger talks to expand DTH business",https://www.livemint.com/companies/news/tata-group-bharti-airtel-terminate-merger-talks-to-expand-dth-business-11746291951761.html,2025-05-03T17:16:05Z,Livemint
Who is Ajit Jain? Indian-origin Berkshire Hathaway VP whom Warren Buffett trusts on AI investments,"Indian-origin Berkshire Hathaway VP, Ajit Jain, is one of the most trusted executives whom Warren Buffett trusts on AI investments. In the shareholder meeting on May 3, Jain called AI to be a game changer for the insurance industry.",https://www.livemint.com/companies/people/who-is-ajit-jain-indian-origin-berkshire-hathaway-vp-whom-warren-buffett-trusts-on-ai-investments-11746282459929.html,2025-05-03T15:44:03Z,Livemint
"India’s film, TV and streaming industry clocked ₹1.1 trillion in FY24, says report","The Indian film, television, and online curated content industry generated Rs. 110,000 crore in FY2024, growing 18% since FY2019. This growth persists despite pandemic challenges, with increased household spending expected to drive demand for entertainment of…",https://www.livemint.com/industry/media/indias-film-tv-and-streaming-industry-clocked-1-1-trillion-in-fy24-says-report-11746195483524.html,2025-05-03T07:30:02Z,Livemint
"Madhusudan Kela Portfolio: बिकवाली के माहौल में पोर्टफोलियो में जोड़े 3 स्टॉक्स, इन शेयरों के वेटेज में बदलाव","Madhusudan Kela Portfolio: मधुसूदन केला के पोर्टफोलियो में पिछली तिमाही जनवरी-मार्च 2025 में बड़े बदलाव हुए। ऐसे समय में जब स्टॉक मार्केट बिकवाली के भारी दबाव से जूझ रहा था, मधुसूदन केला ने इसे खरीदारी के शानदार मौके के तौर पर लिया और धड़ाधड़ कुछ शेयरों की ता…",https://hindi.moneycontrol.com/news/markets/madhusudan-kela-portfolio-added-some-stocks-in-march-quarter-some-stocks-weight-increased-and-decreased-1975058.html,2025-05-03T06:17:46Z,Moneycontrol
Market This week: वीकली आधार पर बाजार लगातार तीसरे हफ्ते बढ़त पर हुआ बंद,"Market This week:   वीकली आधार पर बाजार लगातार तीसरे हफ्ते बढ़त पर बंद हुआ। एफआईआई की लगातार खरीदारी, मिलेजुले Q4 नतीजें, टैरिफ युद्ध तनाव कम होना, रिकॉर्ड जीएसटी कलेक्शन और ग्लोबल मार्केट में सकारात्मक माहौल ने भारतीय बाजार को 1 फीसदी से ज्यादा की साप्ताहिक …",https://hindi.moneycontrol.com/news/markets/market-this-week-on-weekly-basis-the-market-closed-on-a-rise-for-the-third-consecutive-week-1975057.html,2025-05-03T05:36:12Z,Moneycontrol
Mint Explainer: UPI Circle’s vast potential beyond family and friends,This new feature allows you to authorise UPI payments for others such as your children or senior family members via your bank account. But UPI Circle has a bigger agenda that just that.&nbsp;,https://www.livemint.com/industry/banking/upi-circle-delegated-upi-payments-cashless-transactions-financial-inclusion-upi-without-bank-account-upi-for-minors-bhim-11746181776970.html,2025-05-03T04:00:16Z,Livemint
Sahara’s shadow: The spectacular unravelling of Subrata Roy,"He built a financial empire on trust and spectacle, wooed politicians and movie stars, and claimed to uplift millions. Yet, as Subrata Roy died a free man, the mystery of Sahara’s missing billions—and its millions of investors—remains unsolved.",https://www.livemint.com/companies/people/saharas-shadow-the-spectacular-unravelling-of-subrata-roy-11746084390116.html,2025-05-03T02:30:11Z,Livemint
Is quick commerce eating into the food delivery market?,Eternal’s management attributed the slowdown in food delivery during the quarter to a temporary shortage of delivery partners stemming from the expanding quick commerce sector.,https://www.livemint.com/industry/is-quick-commerce-eating-into-the-food-delivery-market-11746185381774.html,2025-05-03T00:30:04Z,Livemint
Cuomo Holds $3 Million of Undisclosed Options in Nuclear Startup,Former New York Governor  Andrew Cuomo has $3 million in options to a shoestring nuclear startup that he failed to disclose to an ethics board as he mounts a comeback bid to be the mayor of New York City.,https://www.livemint.com/companies/news/cuomo-holds-3-million-of-undisclosed-options-in-nuclear-startup-11746230876757.html,2025-05-03T00:07:56Z,Livemint
"Big Oil earnings show split in production strategy, shareholder returns","OIL-RESULTS/ (WRAPUP 1):WRAPUP 1-Big Oil earnings show split in production strategy, shareholder returns",https://www.livemint.com/companies/company-results/big-oil-earnings-show-split-in-production-strategy-shareholder-returns-11746221198779.html,2025-05-02T21:26:38Z,Livemint
DOJ Asks Federal Judge to Break Up Google’s Ad-Tech Tools,The US Justice Department asked a federal judge on Friday to force Alphabet Inc.’s Google to sell key parts of its advertising technology and share realtime data with competitors to address a ruling that the technology giant illegally monopolizes much of the …,https://www.livemint.com/companies/news/doj-asks-federal-judge-to-break-up-google-s-ad-tech-tools-11746217290993.html,2025-05-02T20:21:30Z,Livemint
NY Says ‘Impasse’ Reached Over Congestion Pricing Fight With DOT,"New York fired a salvo in the fight to shield its congestion pricing program from the Trump administration’s push to shut it down, indicating it is now poised to seek an immediate court order in its lawsuit to protect the traffic tolling plan.",https://www.livemint.com/companies/news/ny-says-impasse-reached-over-congestion-pricing-fight-with-dot-11746216615584.html,2025-05-02T20:10:15Z,Livemint
